{
  "catalogo": "efeitos_de_golpe_astuto",
  "nome": "Efeitos de Golpe Astuto",
  "fonte": {
    "capitulo": 3,
    "pagina_livro": 141,
    "pagina_pdf": 145
  },
  "total": 7,
  "nota": "O custo em dados é subtraído do dano do Ataque Furtivo antes de jogar. CD: 8 + mod. de Destreza + BP.",
  "itens": [
    {
      "id": "envenenar",
      "nome": "Envenenar",
      "custo_em_dados": 1,
      "nivel_minimo": 5,
      "descricao_curta": "Salvaguarda de Constituição ou Envenenado por 1 minuto, repetindo no fim de cada turno. Exige Kit de Veneno.",
      "efeitos": [
        {
          "tipo": "conceder_condicao",
          "condicao_id": "envenenado",
          "beneficiario": "alvo",
          "salvaguarda": {
            "atributo": "CON",
            "cd": [
              "8",
              "mod:DES",
              "prof"
            ]
          },
          "duracao": "1 minuto",
          "repete_salvaguarda": {
            "quando": "fim_do_turno_do_alvo",
            "encerra_em_sucesso": true
          },
          "pre_requisitos": [
            {
              "tipo": "item",
              "chave": "kit_de_veneno",
              "revisao": "duvida",
              "nota": "id depende do cap. 6"
            }
          ]
        }
      ],
      "fonte": {
        "capitulo": 3,
        "pagina_livro": 141,
        "pagina_pdf": 145
      },
      "fonte_herdada": true
    },
    {
      "id": "retirada",
      "nome": "Retirada",
      "custo_em_dados": 1,
      "nivel_minimo": 5,
      "descricao_curta": "Move metade do Deslocamento sem provocar Ataques de Oportunidade.",
      "efeitos": [
        {
          "tipo": "conceder_velocidade",
          "tipo_deslocamento": "caminhada",
          "modo": "movimento_imediato",
          "formula": [
            {
              "op": "div_arred_baixo",
              "args": [
                "deslocamento",
                "2"
              ]
            }
          ],
          "sem_provocar_ataques_de_oportunidade": true,
          "momento": "imediatamente_apos_o_ataque"
        }
      ],
      "fonte": {
        "capitulo": 3,
        "pagina_livro": 141,
        "pagina_pdf": 145
      },
      "fonte_herdada": true
    },
    {
      "id": "tropeco",
      "nome": "Tropeço",
      "custo_em_dados": 1,
      "nivel_minimo": 5,
      "descricao_curta": "Alvo Grande ou menor faz salvaguarda de Destreza ou fica Caído.",
      "efeitos": [
        {
          "tipo": "conceder_condicao",
          "condicao_id": "caido",
          "beneficiario": "alvo",
          "salvaguarda": {
            "atributo": "DES",
            "cd": [
              "8",
              "mod:DES",
              "prof"
            ]
          },
          "condicao": {
            "todas": [
              "alvo_de_tamanho_ate:grande"
            ]
          }
        }
      ],
      "fonte": {
        "capitulo": 3,
        "pagina_livro": 141,
        "pagina_pdf": 145
      },
      "fonte_herdada": true
    },
    {
      "id": "aturdir",
      "nome": "Aturdir",
      "custo_em_dados": 2,
      "nivel_minimo": 14,
      "descricao_curta": "Salvaguarda de Constituição ou, no próximo turno, o alvo só pode se mover, agir OU usar uma Ação Bônus.",
      "efeitos": [
        {
          "tipo": "restringir_movimento",
          "beneficiario": "alvo",
          "salvaguarda": {
            "atributo": "CON",
            "cd": [
              "8",
              "mod:DES",
              "prof"
            ]
          },
          "duracao": "proximo_turno_do_alvo",
          "limite": {
            "escolher": 1,
            "entre": [
              "mover",
              "acao",
              "acao_bonus"
            ]
          },
          "nota": "No próximo turno o alvo faz apenas UMA das três coisas."
        }
      ],
      "fonte": {
        "capitulo": 3,
        "pagina_livro": 141,
        "pagina_pdf": 145
      },
      "fonte_herdada": true
    },
    {
      "id": "obscurecer",
      "nome": "Obscurecer",
      "custo_em_dados": 3,
      "nivel_minimo": 14,
      "descricao_curta": "Salvaguarda de Destreza ou o alvo fica Cego até o fim do próximo turno dele.",
      "efeitos": [
        {
          "tipo": "conceder_condicao",
          "condicao_id": "cego",
          "beneficiario": "alvo",
          "salvaguarda": {
            "atributo": "DES",
            "cd": [
              "8",
              "mod:DES",
              "prof"
            ]
          },
          "duracao": "ate_o_fim_do_proximo_turno_do_alvo"
        }
      ],
      "fonte": {
        "capitulo": 3,
        "pagina_livro": 141,
        "pagina_pdf": 145
      },
      "fonte_herdada": true
    },
    {
      "id": "nocaute",
      "nome": "Nocaute",
      "custo_em_dados": 6,
      "nivel_minimo": 14,
      "descricao_curta": "Salvaguarda de Constituição ou Inconsciente por 1 minuto ou até sofrer dano, repetindo no fim de cada turno.",
      "efeitos": [
        {
          "tipo": "conceder_condicao",
          "condicao_id": "inconsciente",
          "beneficiario": "alvo",
          "salvaguarda": {
            "atributo": "CON",
            "cd": [
              "8",
              "mod:DES",
              "prof"
            ]
          },
          "duracao": "1 minuto",
          "encerra_se": [
            {
              "gatilho": "alvo_sofre_qualquer_dano"
            }
          ],
          "repete_salvaguarda": {
            "quando": "fim_do_turno_do_alvo",
            "encerra_em_sucesso": true
          }
        }
      ],
      "fonte": {
        "capitulo": 3,
        "pagina_livro": 141,
        "pagina_pdf": 145
      },
      "fonte_herdada": true
    },
    {
      "id": "ataque_escondido",
      "nome": "Ataque Escondido",
      "custo_em_dados": 1,
      "origem": "subclasse:ladrao",
      "descricao_curta": "Estando Invisível pela ação Esconder, o ataque não encerra a condição se você terminar o turno atrás de Cobertura de Três Quartos ou Total.",
      "apenas_se_concedido": true,
      "nota": "Não é liberado por nível: vem da Furtividade Suprema do Ladrão (nível 9 da subclasse, p. 143).",
      "efeitos": [
        {
          "tipo": "alterar_condicao",
          "condicao_id": "invisivel",
          "operacao": "impedir_encerramento",
          "gatilho_impedido": "atacar",
          "condicao": {
            "todas": [
              "condicao_obtida_por:esconder",
              {
                "alguma": [
                  "termina_o_turno_atras_de:cobertura_tres_quartos",
                  "termina_o_turno_atras_de:cobertura_total"
                ]
              }
            ]
          },
          "nota": "O ataque normalmente encerra a Invisibilidade da ação Esconder; aqui não encerra."
        }
      ],
      "fonte": {
        "capitulo": 3,
        "pagina_livro": 141,
        "pagina_pdf": 145
      },
      "fonte_herdada": true
    }
  ]
}