{
  "catalogo": "tipos_de_deslocamento",
  "nome": "Tipos de Deslocamento",
  "fonte": {
    "capitulo": "ap_c",
    "pagina_livro": 366,
    "pagina_pdf": 370
  },
  "total": 5,
  "itens": [
    {
      "id": "caminhada",
      "nome": "Deslocamento"
    },
    {
      "id": "escalada",
      "nome": "Deslocamento de Escalada"
    },
    {
      "id": "escavacao",
      "nome": "Deslocamento de Escavação"
    },
    {
      "id": "natacao",
      "nome": "Deslocamento de Natação"
    },
    {
      "id": "voo",
      "nome": "Deslocamento de Voo"
    }
  ]
}