{
  "catalogo": "beneficios_do_terceiro_olho",
  "nome": "Benefícios do Terceiro Olho",
  "fonte": {
    "capitulo": 3,
    "pagina_livro": 155,
    "pagina_pdf": 159
  },
  "total": 3,
  "itens": [
    {
      "id": "compreensao_superior",
      "nome": "Compreensão Superior",
      "descricao_curta": "Você pode ler qualquer idioma.",
      "efeitos": [
        {
          "tipo": "substituir_regra",
          "chave": "ler_qualquer_idioma",
          "duracao": "ate_o_proximo_descanso",
          "revisao": "duvida",
          "nota": "Ler qualquer idioma não tem primitivo próprio no esquema; fica como regra declarada até existir um efeito de compreensão de idiomas."
        }
      ],
      "revisao": {
        "status": "duvida",
        "notas": "Ler qualquer idioma não tem primitivo próprio no esquema; fica como substituir_regra até existir um efeito de compreensão de idiomas (provável no cap. 5, com os talentos)."
      },
      "fonte": {
        "capitulo": 3,
        "pagina_livro": 155,
        "pagina_pdf": 159
      },
      "fonte_herdada": true
    },
    {
      "id": "ver_o_invisivel",
      "nome": "Ver o Invisível",
      "descricao_curta": "Conjura Ver o Invisível sem gastar espaço de magia.",
      "efeitos": [
        {
          "tipo": "conjurar_sem_espaco",
          "magia": "ver_o_invisivel"
        }
      ],
      "fonte": {
        "capitulo": 3,
        "pagina_livro": 155,
        "pagina_pdf": 159
      },
      "fonte_herdada": true
    },
    {
      "id": "visao_no_escuro",
      "nome": "Visão no Escuro",
      "descricao_curta": "Visão no Escuro com alcance de 36 metros.",
      "efeitos": [
        {
          "tipo": "conceder_sentido",
          "sentido": "visao_no_escuro",
          "alcance_m": 36,
          "empilha": "substitui_se_maior",
          "duracao": "ate_o_proximo_descanso"
        }
      ],
      "fonte": {
        "capitulo": 3,
        "pagina_livro": 155,
        "pagina_pdf": 159
      },
      "fonte_herdada": true
    }
  ]
}