{
  "catalogo": "tipos_de_descanso",
  "nome": "Tipos de Descanso",
  "fonte": {
    "capitulo": "ap_c",
    "pagina_livro": 365,
    "pagina_pdf": 369
  },
  "total": 2,
  "itens": [
    {
      "id": "descanso_curto",
      "nome": "Descanso Curto",
      "duracao": {
        "quantidade": [
          "1"
        ],
        "unidade": "hora"
      },
      "fonte": {
        "capitulo": "ap_c",
        "pagina_livro": 365,
        "pagina_pdf": 369
      },
      "interrompido_por": [
        "jogar_iniciativa",
        "conjurar_magia_nao_truque",
        "receber_dano"
      ],
      "recupera": {
        "pontos_de_vida": "nenhum",
        "pontos_de_vida_temporarios": "mantem",
        "dados_de_vida": "nenhum"
      }
    },
    {
      "id": "descanso_longo",
      "nome": "Descanso Longo",
      "duracao": {
        "quantidade": [
          "8"
        ],
        "unidade": "hora"
      },
      "fonte": {
        "capitulo": "ap_c",
        "pagina_livro": 366,
        "pagina_pdf": 370
      },
      "interrompido_por": [
        "jogar_iniciativa",
        "conjurar_magia_nao_truque",
        "receber_dano",
        "1h_de_esforco_fisico"
      ],
      "intervalo_minimo_entre_descansos": "16 horas",
      "recupera": {
        "pontos_de_vida": "todos",
        "pontos_de_vida_temporarios": "perde",
        "dados_de_vida": "todos",
        "reducoes_de_maximo": "removidas",
        "reducoes_de_atributo": "removidas",
        "exaustao": -1
      }
    }
  ]
}